{
  "$schema": "../../schema/brand-profile.schema.json",
  "brandProfileId": "example-brand-2",
  "name": "EXAMPLE BRAND 2",
  "subtitle": "DEMO IDENTITY",
  "tagline": "PROOF OF CONCEPT",
  "logo": {
    "primary": "examples/example-brand-2/logo.svg",
    "secondary": null
  },
  "decorativeGraphic": "#icon-decorative",
  "fonts": {
    "heading": "Georgia, \"Times New Roman\", serif",
    "subheading": "\"Inter\", \"Helvetica Neue\", Arial, sans-serif",
    "body": "\"Inter\", \"Helvetica Neue\", Arial, sans-serif",
    "mono": "\"Roboto Mono\", \"Courier New\", monospace"
  },
  "colors": {
    "background": "#FBF3EA",
    "primary": "#5A2E1F",
    "secondary": "#C1652F",
    "accent": "#2F7A5E",
    "border": "#5A2E1F",
    "iconColor": "#8F4A22"
  },
  "icons": {
    "purity": "#icon-purity",
    "labTested": "#icon-lab-tested"
  },
  "qrStyle": {
    "caption": "SCAN FOR COA"
  },
  "countryGraphic": "#icon-origin",
  "border": {
    "thickness": 1.2,
    "radius": 4
  }
}
